{
  "schema_version": 1,
  "catalog_id": "documentation-modifiers",
  "catalog_version": "1.0.0",
  "scope_kinds": ["system", "component", "interface", "data", "operational"],
  "merge_strategies": ["union", "maximum", "minimum", "intersection", "manual-conflict"],
  "modifiers": [
    {"modifier_id":"content-delivery-surface","modifier_kind":"component","name":"Content delivery surface","purpose":"Publish and organize navigable content.","selection_rule":"Select for a governed publishing surface.","non_activation_signals":["transactional workflow is primary"],"compatible_families":["content-knowledge","transactional-application","library-package-sdk"],"dependencies":[],"conflicts_with":[],"scope_kinds":["component","interface"],"capability_demands":["seo-discoverability","accessibility","decisions-ownership-freshness"]},
    {"modifier_id":"interactive-web-surface","modifier_kind":"component","name":"Interactive web surface","purpose":"Govern web interaction, inputs, states, and workflows.","selection_rule":"Select when interactive web behavior is a sustained responsibility.","non_activation_signals":["surface is purely publishing"],"compatible_families":["transactional-application","service-api"],"dependencies":[],"conflicts_with":[],"scope_kinds":["component","interface"],"capability_demands":["validation-acceptance-evidence","accessibility","security"]},
    {"modifier_id":"native-client-surface","modifier_kind":"component","name":"Native client surface","purpose":"Govern an installed client lifecycle.","selection_rule":"Select for mobile or desktop installed clients.","non_activation_signals":["browser-only surface"],"compatible_families":["client-application","transactional-application"],"dependencies":[],"conflicts_with":[],"scope_kinds":["component","interface","data"],"capability_demands":["security","accessibility","continuity-recovery"]},
    {"modifier_id":"synchronous-service","modifier_kind":"component","name":"Synchronous service","purpose":"Respond through a sustained remote request-response contract.","selection_rule":"Select when a synchronous remote interface is governed.","non_activation_signals":["processing is exclusively deferred"],"compatible_families":["service-api","transactional-application","data-machine-learning","agentic-system"],"dependencies":[],"conflicts_with":[],"scope_kinds":["component","interface"],"capability_demands":["security","operations-support","integration-examples"]},
    {"modifier_id":"asynchronous-processor","modifier_kind":"component","name":"Asynchronous processor","purpose":"Process work outside a synchronous request path.","selection_rule":"Select for workers, consumers, schedules, or batches.","non_activation_signals":["request-response is the only responsibility"],"compatible_families":["service-api","transactional-application","data-machine-learning","agentic-system"],"dependencies":[],"conflicts_with":[],"scope_kinds":["component","interface","operational"],"capability_demands":["operations-support","continuity-recovery","validation-acceptance-evidence"]},
    {"modifier_id":"persistent-store","modifier_kind":"component","name":"Persistent store","purpose":"Govern durable persistence with its own lifecycle.","selection_rule":"Select when schema, migration, retention, backup, or recovery is material.","non_activation_signals":["storage is incidental or temporary"],"compatible_families":["transactional-application","service-api","client-application","data-machine-learning","agentic-system"],"dependencies":[],"conflicts_with":[],"scope_kinds":["component","data","operational"],"capability_demands":["privacy","continuity-recovery","data-evolution-reprocessing"]},
    {"modifier_id":"reusable-package","modifier_kind":"component","name":"Reusable package","purpose":"Distribute code with a sustained consumer surface.","selection_rule":"Select for libraries, packages, or SDK components.","non_activation_signals":["module is internal and undistributed"],"compatible_families":["library-package-sdk","transactional-application","service-api","client-application"],"dependencies":[],"conflicts_with":[],"scope_kinds":["component","interface"],"capability_demands":["integration-examples","distribution-integrity"]},
    {"modifier_id":"cli-surface","modifier_kind":"component","name":"CLI surface","purpose":"Expose stable commands, inputs, outputs, and execution results.","selection_rule":"Select for supported human or automation command interfaces.","non_activation_signals":["script is incidental"],"compatible_families":["cli-developer-tool","library-package-sdk","agentic-system"],"dependencies":[],"conflicts_with":[],"scope_kinds":["component","interface"],"capability_demands":["accessibility","integration-examples","distribution-integrity"]},
    {"modifier_id":"data-pipeline","modifier_kind":"component","name":"Data pipeline","purpose":"Move, transform, validate, and reprocess data.","selection_rule":"Select when lineage, quality, or replay is a primary component responsibility.","non_activation_signals":["component is only a durable store"],"compatible_families":["data-machine-learning","service-api"],"dependencies":[],"conflicts_with":[],"scope_kinds":["component","data","operational"],"capability_demands":["data-evolution-reprocessing","operations-support","continuity-recovery"]},
    {"modifier_id":"model-lifecycle","modifier_kind":"component","name":"Model lifecycle","purpose":"Train, evaluate, promote, register, and monitor models.","selection_rule":"Select for governed model lifecycle responsibilities.","non_activation_signals":["notebook is exploratory only"],"compatible_families":["data-machine-learning","agentic-system"],"dependencies":[],"conflicts_with":[],"scope_kinds":["component","data","operational"],"capability_demands":["model-development-evaluation","model-operations"]},
    {"modifier_id":"agentic-orchestrator","modifier_kind":"component","name":"Agentic orchestrator","purpose":"Coordinate autonomy, tools, context, memory, approvals, and evals.","selection_rule":"Select when material autonomous action is governed.","non_activation_signals":["LLM feature is subordinate and non-autonomous"],"compatible_families":["agentic-system","transactional-application","service-api"],"dependencies":[],"conflicts_with":[],"scope_kinds":["component","interface","data","operational"],"capability_demands":["agent-traceability-audit","agent-containment-recovery","security"]},
    {"modifier_id":"public-exposure","modifier_kind":"concern","name":"Public exposure","purpose":"Harden externally exposed surfaces.","selection_rule":"Activate outside a controlled internal boundary.","non_activation_signals":["surface remains internal and controlled"],"compatible_families":["content-knowledge","transactional-application","service-api","library-package-sdk","cli-developer-tool","client-application","data-machine-learning","agentic-system"],"dependencies":[],"conflicts_with":[],"scope_kinds":["system","component","interface"],"capability_demands":["security","operations-support"],"requires_named_basis":false},
    {"modifier_id":"personal-data","modifier_kind":"concern","name":"Personal data","purpose":"Govern identifiable or linkable personal data.","selection_rule":"Activate when personal data is processed.","non_activation_signals":["no personal data is processed"],"compatible_families":["content-knowledge","transactional-application","service-api","library-package-sdk","cli-developer-tool","client-application","data-machine-learning","agentic-system"],"dependencies":[],"conflicts_with":[],"scope_kinds":["system","component","data"],"capability_demands":["privacy","security"],"requires_named_basis":false},
    {"modifier_id":"regulated-data","modifier_kind":"concern","name":"Regulated data","purpose":"Govern data subject to a named regulatory basis.","selection_rule":"Activate only with an identified regulatory basis.","non_activation_signals":["no applicable regulatory basis"],"compatible_families":["transactional-application","service-api","client-application","data-machine-learning","agentic-system"],"dependencies":[],"conflicts_with":[],"scope_kinds":["system","component","data"],"capability_demands":["privacy","security","decisions-ownership-freshness"],"requires_named_basis":true},
    {"modifier_id":"multi-tenancy","modifier_kind":"concern","name":"Multi-tenancy","purpose":"Govern tenant isolation and shared-resource boundaries.","selection_rule":"Activate when multiple tenants share governed resources.","non_activation_signals":["single controlled tenant"],"compatible_families":["transactional-application","service-api","data-machine-learning","agentic-system"],"dependencies":[],"conflicts_with":[],"scope_kinds":["system","component","data"],"capability_demands":["security","privacy","context-boundaries-dependencies"],"requires_named_basis":false},
    {"modifier_id":"offline-operation","modifier_kind":"concern","name":"Offline operation","purpose":"Govern durable work without continuous connectivity.","selection_rule":"Activate when offline work or reconciliation is required.","non_activation_signals":["connectivity is required for all useful work"],"compatible_families":["client-application","transactional-application","cli-developer-tool"],"dependencies":[],"conflicts_with":[],"scope_kinds":["component","data","interface"],"capability_demands":["continuity-recovery","data-evolution-reprocessing"],"requires_named_basis":false},